[
  {
    "id": "OPO-0001",
    "ficticio": true,
    "origem": "demo",
    "criadoEm": "2026-09-10T12:00:00.000Z",
    "atualizadoEm": "2026-09-10T12:00:00.000Z",
    "criadoPor": "humano",
    "titulo": "Reposição anual de privativos — Hospital Alfa",
    "clienteId": "CLI-0001",
    "leadId": null,
    "responsavelId": "AGT-0005",
    "segmento": "saude",
    "etapa": "negociacao",
    "valorEstimado": 89900,
    "ultimoContatoEm": "2026-10-29",
    "proximoPasso": "Retornar com proposta revisada após aprovação interna",
    "proximoPassoEm": "2026-10-30",
    "previsaoFechamentoEm": "2026-11-15",
    "fechadoEm": null,
    "estrategica": true,
    "qualificacao": {
      "quantidadePecas": 1000,
      "tipoUniforme": "conjunto privativo hospitalar",
      "tecido": "brim leve 100% algodão (a confirmar ficha técnica)",
      "grade": "P a GG",
      "frequenciaReposicao": "anual",
      "personalizacao": "bordado do logotipo no peito",
      "prazoPretendido": "2026-12-20",
      "localEntrega": "almoxarifado central do cliente",
      "faixaOrcamento": null,
      "processoDecisao": "compras + enfermagem",
      "exigeAmostra": true
    },
    "motivoPerda": null,
    "concorrenteInformado": null
  },
  {
    "id": "OPO-0002",
    "ficticio": true,
    "origem": "demo",
    "criadoEm": "2026-09-20T12:00:00.000Z",
    "atualizadoEm": "2026-09-20T12:00:00.000Z",
    "criadoPor": "humano",
    "titulo": "Polos bordadas para equipe de campo",
    "clienteId": "CLI-0003",
    "leadId": null,
    "responsavelId": "AGT-0005",
    "segmento": "industria",
    "etapa": "proposta_enviada",
    "valorEstimado": 16200,
    "ultimoContatoEm": "2026-10-15",
    "proximoPasso": "Follow-up da proposta enviada",
    "proximoPassoEm": "2026-10-20",
    "previsaoFechamentoEm": "2026-11-10",
    "fechadoEm": null,
    "estrategica": false,
    "qualificacao": {
      "quantidadePecas": 300,
      "tipoUniforme": "camisa polo",
      "tecido": null,
      "grade": null,
      "frequenciaReposicao": null,
      "personalizacao": "bordado frente e costas",
      "prazoPretendido": "2026-11-30",
      "localEntrega": "planta do cliente",
      "faixaOrcamento": null,
      "processoDecisao": null,
      "exigeAmostra": null
    },
    "motivoPerda": null,
    "concorrenteInformado": null
  },
  {
    "id": "OPO-0003",
    "ficticio": true,
    "origem": "demo",
    "criadoEm": "2026-10-05T12:00:00.000Z",
    "atualizadoEm": "2026-10-05T12:00:00.000Z",
    "criadoPor": "humano",
    "titulo": "Jalecos para rede de clínicas",
    "clienteId": null,
    "leadId": "LEA-0001",
    "responsavelId": "AGT-0006",
    "segmento": "saude",
    "etapa": "cotacao_solicitada",
    "valorEstimado": null,
    "ultimoContatoEm": "2026-10-25",
    "proximoPasso": null,
    "proximoPassoEm": null,
    "previsaoFechamentoEm": null,
    "fechadoEm": null,
    "estrategica": false,
    "qualificacao": {
      "quantidadePecas": 250,
      "tipoUniforme": "jaleco",
      "tecido": null,
      "grade": null,
      "frequenciaReposicao": null,
      "personalizacao": null,
      "prazoPretendido": "2026-12-10",
      "localEntrega": null,
      "faixaOrcamento": null,
      "processoDecisao": null,
      "exigeAmostra": null
    },
    "motivoPerda": null,
    "concorrenteInformado": null
  },
  {
    "id": "OPO-0004",
    "ficticio": true,
    "origem": "demo",
    "criadoEm": "2026-10-10T12:00:00.000Z",
    "atualizadoEm": "2026-10-10T12:00:00.000Z",
    "criadoPor": "humano",
    "titulo": "Uniformes de limpeza — contrato recorrente",
    "clienteId": "CLI-0004",
    "leadId": null,
    "responsavelId": "AGT-0006",
    "segmento": "facilities",
    "etapa": "contato_realizado",
    "valorEstimado": 45000,
    "ultimoContatoEm": "2026-10-28",
    "proximoPasso": "Visita técnica para levantamento de grade",
    "proximoPassoEm": "2026-11-04",
    "previsaoFechamentoEm": "2026-12-15",
    "fechadoEm": null,
    "estrategica": false,
    "qualificacao": {
      "quantidadePecas": null,
      "tipoUniforme": null,
      "tecido": null,
      "grade": null,
      "frequenciaReposicao": null,
      "personalizacao": null,
      "prazoPretendido": null,
      "localEntrega": null,
      "faixaOrcamento": null,
      "processoDecisao": null,
      "exigeAmostra": null
    },
    "motivoPerda": null,
    "concorrenteInformado": null
  },
  {
    "id": "OPO-0005",
    "ficticio": true,
    "origem": "demo",
    "criadoEm": "2026-09-01T12:00:00.000Z",
    "atualizadoEm": "2026-09-01T12:00:00.000Z",
    "criadoPor": "humano",
    "titulo": "Macacões operacionais",
    "clienteId": "CLI-0003",
    "leadId": null,
    "responsavelId": "AGT-0005",
    "segmento": "industria",
    "etapa": "pedido_ganho",
    "valorEstimado": 30400,
    "ultimoContatoEm": "2026-10-22",
    "proximoPasso": "Acompanhar produção e entrega",
    "proximoPassoEm": "2026-11-03",
    "previsaoFechamentoEm": "2026-10-22",
    "fechadoEm": "2026-10-22",
    "estrategica": false,
    "qualificacao": {
      "quantidadePecas": 320,
      "tipoUniforme": "macacão",
      "tecido": null,
      "grade": null,
      "frequenciaReposicao": null,
      "personalizacao": "refletivo + logotipo",
      "prazoPretendido": "2026-11-03",
      "localEntrega": "planta do cliente",
      "faixaOrcamento": null,
      "processoDecisao": null,
      "exigeAmostra": null
    },
    "motivoPerda": null,
    "concorrenteInformado": null
  },
  {
    "id": "OPO-0006",
    "ficticio": true,
    "origem": "demo",
    "criadoEm": "2026-09-15T12:00:00.000Z",
    "atualizadoEm": "2026-09-15T12:00:00.000Z",
    "criadoPor": "humano",
    "titulo": "Kit obra — camisetas e calças",
    "clienteId": "CLI-0005",
    "leadId": null,
    "responsavelId": "AGT-0006",
    "segmento": "construcao",
    "etapa": "pedido_perdido",
    "valorEstimado": 18000,
    "ultimoContatoEm": "2026-10-24",
    "proximoPasso": "Recontato no próximo semestre",
    "proximoPassoEm": "2027-03-01",
    "previsaoFechamentoEm": null,
    "fechadoEm": "2026-10-24",
    "estrategica": false,
    "qualificacao": {
      "quantidadePecas": null,
      "tipoUniforme": null,
      "tecido": null,
      "grade": null,
      "frequenciaReposicao": null,
      "personalizacao": null,
      "prazoPretendido": null,
      "localEntrega": null,
      "faixaOrcamento": null,
      "processoDecisao": null,
      "exigeAmostra": null
    },
    "motivoPerda": "preço acima do orçamento do cliente",
    "concorrenteInformado": "não informado pelo cliente"
  },
  {
    "id": "OPO-0007",
    "ficticio": true,
    "origem": "demo",
    "criadoEm": "2026-10-20T12:00:00.000Z",
    "atualizadoEm": "2026-10-20T12:00:00.000Z",
    "criadoPor": "humano",
    "titulo": "Licitação de uniformes — Prefeitura Eta",
    "clienteId": null,
    "leadId": "LEA-0002",
    "responsavelId": "AGT-0004",
    "segmento": "publico",
    "etapa": "lead_identificado",
    "valorEstimado": null,
    "ultimoContatoEm": null,
    "proximoPasso": "Ler o edital e checar requisitos de habilitação",
    "proximoPassoEm": "2026-11-03",
    "previsaoFechamentoEm": null,
    "fechadoEm": null,
    "estrategica": false,
    "qualificacao": {
      "quantidadePecas": null,
      "tipoUniforme": null,
      "tecido": null,
      "grade": null,
      "frequenciaReposicao": null,
      "personalizacao": null,
      "prazoPretendido": null,
      "localEntrega": null,
      "faixaOrcamento": null,
      "processoDecisao": null,
      "exigeAmostra": null
    },
    "motivoPerda": null,
    "concorrenteInformado": null
  }
]
